AU,TI,PY,JO
"BASAVARAJAPPA, K. G.","Employment Income of Immigrants In Metropolitan Areas of Canada, 1980*",1989,International Migration
"JONGKIND, F.","The Agrarian Colonies of Dutch Calvinists in Paraná, Brazil",1989,International Migration
"Perruchoud, R.",Family Reunification*,1989,International Migration
"Passaris, C.",Immigration and the Evolution of Economic Theory,1989,International Migration
"Wotherspoon, T.",Immigration and the Production of a Teaching Force: Policy Implications for Education and Labour,1989,International Migration
"Looney, R. L.",Patterns of Remittances and Labor Migration in the Arab World,1989,International Migration
"Kumagai, F.",Current Trends And Developments,1989,International Migration
"GOULD, W. T. S.",Occupational Continuity and International Migration of Skilled Workers: The Case of Mersey Port Workers,1990,International Migration
"FINDLAY, A.",A Migration Channels Approach to the Study of High Level Manpower Movements: A Theoretical Perspective,1990,International Migration
"LOONEY, R. E.",Macroeconomic Impacts of Worker Remittances on Arab World Labor Exporting Countries,1990,International Migration
"DIKAIOU, M.",Illiteracy and Tsigani Minority Children in Northern Greece: An Exploration of Parents' and Children's Views,1990,International Migration
"DUMAN, B.L.",The Israeli Kibbutz Ulpan: A Critical Look at a Unique Method of Immigrant Orientation and Absorption*,1990,International Migration
"BEGAG, A.",The French-Born Youths Originating in North-African Immigration. From Socio-Spatial Relegation to Political Participation,1990,International Migration
"HASENAU, M.",Setting Norms in the United Nations System: The Draft Convention on the Protection of the Rights of All Migrant Workers and their Families in Relation to ILO in Standards on Migrant Workers,1990,International Migration
"METWALLY, M.F.",The Impact of Migrants' Remittances on the Egyptian Economy,1990,International Migration
"GUSTAFSSON, B.",Public Sector Transfers and Income Taxes among Immigrants and Natives in Sweden*,1990,International Migration
"GREČIČ, V.",The Importance of Migrant Workers' and Emigrants' Remittances for the Yugoslav Economy,1990,International Migration
"SAMHA, M.",The Impact of Migratory Flows on Population Changes in Jordan: A Middle Eastern Case Study,1990,International Migration
"Kitching, R. T.",Labour Migration and the Work Permit System in the United Kingdom,1990,International Migration
"Steinberg, J.",Jewish Emigrants to Cuba: 1898–1960,1990,International Migration
"Mann, E. S.",Reconceptualizing Migration as a Household Phenomenon: Outmigration from New York City by Race and Hispanic Origin,1990,International Migration
"Satzewich, V.",Rethinking Post-1945 Migration to Canada: Towards a Political Economy of Labour Migration*,1990,International Migration
"ZagÓrski, K.",Regional Differences in Immigration and Economic Structure in Australia,1990,International Migration
"KHASIANI, S. A.",Refugee Research in Africa: Problems and Possibilities,1990,International Migration
"George, M. V.","Immigrant Fertility Patterns in Canada, 1961–1986*",1990,International Migration
"Zodgekar, A. V.",British Emigrants to New Zealand: their Motives and Expectations,1990,International Migration
"Verma, R. B. P.",Mortality Differentials among Immigrant Populations in Canada*,1990,International Migration
"Schuerman, L. A.","Variations in Fertility and Earning Patterns among Immigrants in the United States, 1970–1980: Assimilation or Disruption?*",1990,International Migration
"Schoorl, J. J.",Fertility Adaptation of Turkish and Moroccan Women in The Netherlands*,1990,International Migration
"Mitra, S.",Long Term Demographic Effect of a Constant Stream of Immigration when the Population is not Reproducing Itself*,1990,International Migration
"Karmi, G.",The Health Status and Health Beliefs of Two London Migrant Communities,1991,International Migration
"Meheus, A.",Sexually Transmitted Diseases and Migration,1991,International Migration
"Tomasevski, K.","Aids, Travel and Migration: Legal and Human Rights Aspects",1991,International Migration
"Faustino–Santos, R.",Canadian Immigrants and Criminality,1991,International Migration
"Du Toit, Brian M.",Immigration and Ethnicity: The Case of Argentina,1991,International Migration
"Montgomery, R.",Predicting Vietnamese Refugee Adjustment to Western Canada,1991,International Migration
"LundströM, S.",Bilateral Municipal Cooperation On Migrants. Return Ticket Kulu-Stockholm,1991,International Migration
"Sen, F.",Turkish Self-Employment In The Federal Republic Of Germany With Special Regard To Northrhine-Westphalia,1991,International Migration
"STAHL, C. W.",South-North Migration in the Asia-Pacific Region,1991,International Migration
"SARMIENTO, J. N.",The Asian Experience in International Migration,1991,International Migration
"ADEPOJU, A.",South-North Migration: The African Experience,1991,International Migration
"ESCOBAR-NAVIA, R.",South-North Migration in the Western Hemisphere,1991,International Migration
"MUNIZ, C. M.",The Emigration of Argentine Professionals and Scientists,1991,International Migration
"GREČIC, V.",East-West Migration and its Possible Influence on South-North Migration,1991,International Migration
"HEINS, F.",South-North Migration with Special Reference to Europe,1991,International Migration
"HEYDEN, H.",South-North Migration*,1991,International Migration
"PAPADEMETRIOU, D. G.",South-North Migration in the Western Hemisphere and US Responses,1991,International Migration
"ZLOTNIK, H.",Trends in South to North Migration: The Perspective from the North,1991,International Migration
"ARDITTIS, S.",Targeted Reintegration of Expatriate Brains into Developing Countries of Origin: The EEC-IOM Experience in Central America*,1991,International Migration
"EBANKS, G. E.",The Human Condition of West Indian Migrant Farm Labour in Southwestern Ontario,1991,International Migration
"MOROKVASIC, M.",Roads to Independence. Self-Employed Immigrants and Minority Women in Five European States*,1991,International Migration
"KURIAN, G.",South Asians in Canada,1991,International Migration
"POHJOLA, A.",Social Networks,1991,International Migration
"HUANG, W. C.","Cross Sectional Analysis of Indirect Professional Immigration to the United States, 1964–1974",1991,International Migration
"TORREALBA, R.",La Familia Migrante: Estrategias de Subsistencia en Familias Dominicanas en Venezuela,1991,International Migration
"CRUZ, A. M.",WILL THE EUROPEAN COMMUNITY MAKE THE 1992 DEADLINE ON THE ABOLITION OF INTERNAL BORDER CONTROLS ?,1991,International Migration
"Addleton, J.",The Impact of the Gulf War on Migration and Remittances in Asia and the Middle East,1991,International Migration
"Miles, R.",Migration to Britain: The Significance of a Historical Approach,1991,International Migration
"Kirisci, K.",Refugee Movements and Turkey,1991,International Migration
"Ismail, H. F.",Family Ties and Economic Stability Concerns of Migrant Labour Families in Jordan,1991,International Migration
"Schuerman, L. A.","Migration from Latin American Countries to the United States: The Economic, Social and Reproductive Lives of Hispanic Female Immigrants, 1980",1991,International Migration
"Ramos, H.",El México del “otro lado”: Los inmigrantes mexicanos en los Estados Unidos,1991,International Migration
"Appleyard, R. T.",Migration and Development: A Global Agenda for the Future,1992,International Migration
"Rogers, R.",The Politics of Migration in the Contemporary World,1992,International Migration
"Fonteneau, G.","The Rights of Migrants, Refugees or Asylum Seekers under International Law",1992,International Migration
"Berry, J. W.",Acculturation and Adaptation in a New Society,1992,International Migration
"Fernando, S.",Racism and the Health of Ethnic Minorities,1992,International Migration
"Bollini, P.",Health Policies for Immigrant Populations in the 1990s. A Comparative Study in Seven Receiving Countries,1992,International Migration
"Downing, T.",The Use of Bilingual/Bicultural Workers as Providers and Interpreters,1992,International Migration
"Karmi, G.",Educating London Doctors in Migration and Health: A New Initiative,1992,International Migration
"Kliewer, E.",Epidemiology of Diseases among Migrants,1992,International Migration
"Tousignant, M.",Migration and Mental Health. Some Prevention Guidelines,1992,International Migration
"Ebrahim, S.",Social and Medical Problems of Elderly Migrants,1992,International Migration
"Bennegadi, R.",Migration and Health — What Does the Future Hold?,1992,International Migration
"Keane, V.",Migrant Medical Processing — A Confusing Blend,1992,International Migration
"McCance, C.",Medical Screening of Migrants: Current National Requirements in the United States,1992,International Migration
"Loutan, L.",Medical Screening of Asylum Seekers in Switzerland,1992,International Migration
"King, K.",Medical Screening of Migrants in Australia,1992,International Migration
"Ramasundaram, S.",A Comparative Analysis of the Position of Undocumented Mexicans in the Los Angeles County Work Force in 1980,1992,International Migration
"Rubenstein, H.","Migration, Development and Remittances in Rural Mexico",1992,International Migration
"Stubos, G.",The Greek Immigrant Family in the United States and Canada: The Transition from an “Institutional” to a “Relational” Form (1945–1970),1992,International Migration
"Looney, R. E.",Manpower Options in a Small Labour-Importing State: The Influence of Ethnic Composition on Kuwait's Development,1992,International Migration
"Song, J. H. L.",Culture Conflict Revisited: Fraud by Vietnamese Physicians in the United States,1992,International Migration
"Straubhaar, Thomas",Migration Pressure,1993,International Migration
"Schaeffer, Peter V.",A Definition of Migration Pressure Based on Demand Theory,1993,International Migration
"Sassen, Saskia",Economic Internationalization:The New Migration in Japan and the United States,1993,International Migration
"Athukorala, Premachandra",Improving the Contribution of Migrant Remittances to Development: The Experience of Asian Labour-exporting Countries,1993,International Migration
"Ball, Jane",Nurse Mobility in Europe: Implications for the United Kingdom,1993,International Migration
"Laughlin, Jim Mac",Ireland: An “Emigrant Nursery” in the World Economy,1993,International Migration
"Wong, Lloyd L.",Immigration as Capital Accumulation: The Impact of Business Immigration to Canada,1993,International Migration
"Purcell, James N.",Japan and International Migration: Challenges and Opportunities,1993,International Migration
"Appleyard, Reginald",International Migration in East Asia: Situation and Issues,1993,International Migration
"Kawai, Saburo",Japan and International Migration: Situation and Issues,1993,International Migration
"Viccars, Che",Temporary Employment in Australia,1993,International Migration
"Fong, Pang Eng","Labour Migration to the Newly-Industrialising Economies of South Korea, Taiwan, Hong Kong and Singapore",1993,International Migration
"Papademetriou, Demetrios G.",Illegal Mexican Migration in the United States and US Responses,1993,International Migration
"Stahl, Charles W.","Low-Level Manpower Migration to Japan: Trends, Issues and Policy Considerations",1993,International Migration
"Blaschke, Jochen",Gates of Immigration into the Federal Republic of Germany,1993,International Migration
"Abella, Manolo I.",Role of Formal Labour Schemes in the Development of Third World Countries,1993,International Migration
"Lohrmann, Reinhard",Labour Migration Policies of European Countries,1993,International Migration
"Kiosseoglou, Grigoris",Identified Problems and Coping Strategies: Gypsy Minority Versus Non-Minority Adolescents,1993,International Migration
"Kargar, Howard Jacob",The Politics of Immigration Policy in Israel,1993,International Migration
"Carmichael, George A.",A History of Population Movement between New Zealand and Australia,1993,International Migration
"Halli, S. S.","Land Development and Transmigrant Farmers in Southern Sumatra, Indonesia",1993,International Migration
"Llambias-Wolff, Jaime",The Voluntary Repatriation Process of Chilean Exiles,1993,International Migration
"Barbero-Baconnier, Julie",When Peace Breaks Out,1993,International Migration
"Oucho, John O.",Towards Migration Research Networking in Eastern-Southern African Subregions,1993,International Migration
"Shah, Nasra M.",Arab Labour Migration: A Review of Trends and Issues,1994,International Migration
"Dikaiou, Maria",Present Realities and Future Prospects among Greek Returners,1994,International Migration
"Kosinski, Leszek A.",The Model of Place Utility Revisited,1994,International Migration
"Icduygu, Ahmet",Facing Changes and Making Choices: Unintended Turkish Immigrant Settlement in Australia,1994,International Migration
"Rao, Shobha",Reversing the Flow: Agricultural Development and Changing Migration Patterns in Rural Maharashtra,1994,International Migration
"Hager, Paul",The Distinction between Skills Based and Qualifications Based Procedures for Recognizing Migrants' Professional Skills*,1994,International Migration
"Appleyard, Reginald",IOM/UNFPA Project on Emigration Dynamics in Developing Countries,1994,International Migration
"Adepoju, Aderanti",Preliminary Analysis of Emigration Dynamics in Sub-Saharan Africa,1994,International Migration
"Shah, Nasra M.",An Overview of Present and Future Emigration Dynamics in South Asia,1994,International Migration
"Castillo, Manuel Angel","A Preliminary Analysis of Emigration Determinants in Mexico, Central America, Northern South America and the Caribbean1",1994,International Migration
"Buetow, Stephen A.",International Migration: Some Consequences for Urban Areas in Australia and New Zealand,1994,International Migration
"Nogle, June Marie",The Systems Approach to International Migration: An Application of Network Analysis Methods,1994,International Migration
"Ögelman, Nedim",Recent Developments in East-West Migration: Turkey and the Petty Traders,1994,International Migration
"Menjivar, Cecilia",Salvadorian Migration to the United States in the 1980s. What can we learn about it and from it?1,1994,International Migration
"Ngo, Hang-yue",The Economic Role of Immigrant Wives in Hong Kong1,1994,International Migration
"Baver, Sherrie L.",Implementation of Congressional Intent: A Study of Amnesty Policy and the Immigration and Naturalization Service,1994,International Migration
"Tsokhas, Kosmas",Immigration and Unemployment in Australia,1994,International Migration
"Jandl, Michael",Is Migration Supply – or Demand – Determined?. Some remarks on the ideological use of economic language,1994,International Migration
"Kesmez, Selim S.",Elderly Turkish Immigrants' Access to and Future Use of Health and Social Services in Copenhagen1,1994,International Migration
"Mahmood, Raisul Awal",Adaptation to a New World: Experience of Bangladeshis in Japan1,1994,International Migration
"Kadioglu, Ayse",The Impact of Migration on Gender Roles: Findings of Field Research in Turkey1,1994,International Migration
"Ghimire, K.",Refugees and Deforestation1,1994,International Migration
"Barbara, Augustin",Mixed Marriages. Some Key Questions1,1994,International Migration
"APPLEYARD, R. T.",EMIGRATION DYNAMICS IN DEVELOPING COUNTRIES,1994,International Migration
"GUNATILLEKE, G.",INTERNATIONAL RESPONSE TO TRAFFICKING IN MIGRANTS AND THE SAFEGUARDING OF MIGRANT RIGHTS,1994,International Migration
"Shuval, Judith T.",Occupational Continuity and Change among Immigrant Physicians from the Former Soviet Union in Israel1,1995,International Migration
"Oucho, John O.",International Migration and Sustainable Human Development in Eastern and Southern Africa,1995,International Migration
"Altzinger, Wilfried",How Labour Market Experiences of Migrants Differ: Australia and Austria Compared1,1995,International Migration
"Amankwaa, Adansi A.",The World Economic System and International Migration in Less Developed Countries: An Ecological Approach1,1995,International Migration
"Dekker, Rein",Forced Homecoming: Ghanaians' Resettlement in their Rural Hometown. A Case Study,1995,International Migration
"Glytsos, Nicholas P.",Problems and Policies Regarding the Socio-economic Integration of Returnees and Foreign Workers in Greece1,1995,International Migration
"Farrag, Mayar",Black Markets in Foreign Exchange and International Migration: The Case of Egypt 1976–1990,1995,International Migration
"Bariagaber, Assefaw",Linking Political Violence and Refugee Situations in the Horn of Africa: An Empirical Approach1,1995,International Migration
"Khaled, Louhichi",Migration and Women's Status: The Jordan Case,1995,International Migration
"Chen, Shyh-jer",Migrant Selectivity and Returns to Skills: The Case of Taiwanese Immigrants in the United States1,1995,International Migration
"Appleyard, R. T.",Note from the Editor,1995,International Migration
"Appleyard, Reginald",Emigration Dynamics in Developing Countries,1995,International Migration
"Adepoju, Aderanti",Emigration Dynamics in Sub-Saharan Africa1,1995,International Migration
"Oucho, John O.",Emigration Dynamics of Eastern African Countries,1995,International Migration
"Diarra, Sekouba",Emigration from the Sahel,1995,International Migration
"Shah, Nasra M.",Emigration Dynamics from and within South Asia,1995,International Migration
"Mathur, M. D.",Emigration Dynamics: The Indian Context,1995,International Migration
"Gunatilleke, Godfrey","The Economic, Demographic, Sociocultural and Political Setting for Emigration from Sri Lanka",1995,International Migration
"Mahmood, Raisul Awal",Emigration Dynamics in Bangladesh,1995,International Migration
"Azam, Farooq-i",Emigration Dynamics in Pakistan,1995,International Migration
"Beenstock, Michael",The Acquisition of Language Skills by Immigrants: The Case of Hebrew in Israel,1996,International Migration
"Bailey, Adrian J.",The Circular Migration of Puerto Rican Women: Towards a Gendered Explanation,1996,International Migration
"Hawthorne, Lesleyanne",Asian Student Migration to Australia1,1996,International Migration
"Mahmood, Raisul Awal","Labour Crunch, Foreign Workers and Policy Responses: The Experience of Japan1",1996,International Migration
"Samuel, T.J.",India-born Immigrants in Australia and Canada: A Comparison of Selected Characteristics,1996,International Migration
"Barbero-Baconnier, Julie",MIGRANT WOMEN: THE PATH FROM BEIJING,1996,International Migration
"Hugo, Graeme",AUSTRALIA'S POPULATION AND THE GLOBAL LINKS,1996,International Migration
"Chinchilla, Norma Stoltz",Global Economic Restructuring and International Migration:,1996,International Migration
"Clarke, Harry",United Kingdom Labour Emigration and Capital Exports 1816–1991,1996,International Migration
"Icduygu, Ahmet",Becoming a New Citizen in an Immigration Country: Turks in Australia and Sweden and Some Comparative Implications,1996,International Migration
"Iskander, Mahmoud A.",An Optimized Model for Substitution of Expatriate Workforce in a Gulf-Council Country: The Kuwaiti Case,1996,International Migration
"Xideas, E.",The Economic Determinants of Greek Return Migration to the Islands of the East Aegean,1996,International Migration
"Appleyard, Reginald",The Relevance of Research on Emigration Dynamics for Policy Makers in Sub-Saharan Africa,1996,International Migration
"Lohrmann, Reinhard",Environmentally-Induced Population Displacements And Environmental Impacts From Mass Migrations,1996,International Migration
"Ekberg, Jan",Labour Market Career among Young Finnish Immigrants in Sweden: A Longitudinal Study,1996,International Migration
"Kirisçi, Kemal",Refugees of Turkish Origin: “Coerced Immigrants” to Turkey since 1945,1996,International Migration
"Iredale, Robyn",Human Resources Development in APEC and Australia's Migration and Training Policies,1996,International Migration
"Shields, Michael P.",A Model of Temporary Migration: The Egyptian Case,1996,International Migration
"Katseli, Louka T.",Illegal Immigration and Local Labour Markets: The Case of Northern Greece,1996,International Migration
"Appleyard, Reginald","Emigration Dynamics In Mexico, Central America And The Caribbean.",1996,International Migration
"Horowitz, Tamar",Value-Oriented Parameters in Migration Policies in the 1990s: The Israeli Experience,1996,International Migration
"Wickramasekara, Piyasiri",International Labour Migration Statistics in Asia: An Appraisal,1996,International Migration
"Hassan, Riaz",Residential Choices of Immigrants in Australia,1996,International Migration
"Liu, Xiao-Feng","A Case Study of the Labour Market Status of Recent Mainland Chinese Immigrants, Metropolitan Toronto",1996,International Migration
"Golub, Branka",Croatian Scientists' Drain and its Roots,1996,International Migration
"Appleyard, Reginald",Emigration Dynamics In South Asia.,1996,International Migration
"Appleyard, Reginald",Emigration Dynamics In The Arab Region,1996,International Migration
"Hill, Lloyd",Emergent Migration Policy in a Democratic South Africa,1997,International Migration
"Kamerschen, David R.",Migration as a Consumption Activity,1997,International Migration
"Heer, David M.",Unauthorized Mexican Workers in the 1990 Los Angeles County Labour Force,1997,International Migration
"Drbohlav, Dusan",Migration Policy Objectives for European East-West International Migration,1997,International Migration
"Hui, Weng-Tat","Regionalization, Economic Restructuring and Labour Migration in Singapore",1997,International Migration
"Neo, Leanne M.",Immigrant Unemployment: The Australian Experience,1997,International Migration
"Ben Menahem, Yitzhak",The Labour Market Absorption of CIS Immigrants to Israel: 1989–1994,1997,International Migration
"Halli, S.S.","A Comparative Study of Immigrant and Non-immigrant Families in Canada with Special Reference to Income, 1986",1997,International Migration
"Lebok, U.H.",The Fertility of Migrants Before and After Crossing the Border: The Ethnic German Population from the Former Soviet Union as a Case Study,1997,International Migration
"Roer-Strier, Dorit",In the Mind of the Beholder: Evaluation of Coping Styles of Immigrant Parents,1997,International Migration
"Farrag, Mayar",Managing International Migration in Developing Countries,1997,International Migration
"Içduygu, Ahmet",The Consequences of International Migration for the Status of Women: A Turkish Study,1997,International Migration
"Gold, Gerald",Constructing Ethnicity: Myth of Return and Modes of Exclusion among Israelis in Toronto,1997,International Migration
"Hawthorne, Lesleyanne",The Question of Discrimination: Skilled Migrants’ Access to Australian Employment,1997,International Migration
"Glytsos, Nicholas P.",Greek Immigrants in Australia: Demographic Developments and Economic Integration,1997,International Migration
"Stein, Jeremy",Migration as a Business: The Case of Trafficking,1997,International Migration
"Yanay, Uri",Temporary and Illegal Labour Migration: The Israeli Experience,1997,International Migration
"Abusharaf, Rogaia M.",Sudanese Migration to the New World: Socio-economic Characteristics,1997,International Migration
"Kadıoğlu, Ayşe",Migration Experiences of Turkish Women: Notes from a Researcher’s Diary,1997,International Migration
"Nault, François","Fertility among Recent Immigrant Women to Canada, 1991: An Examination of the Disruption Hypothesis",1997,International Migration
"Shuval, Judith T.",Migration To Israel: The Mythology of “Uniqueness”,1998,International Migration
"Liu, Xi’an",From Student to Citizen: A Survey of Students from the People’s Republic of China (PRC) in Australia,1998,International Migration
"Jesilow, Paul",Conveying a Sense of Community along Bolsa Avenue: Little Saigon as a Model of Ethnic Commercial Belts,1998,International Migration
"Langfield, Michele",The Welsh Patagonian Connection: A Neglected Chapter in Australian Immigration History,1998,International Migration
"Passaris, Constantine",The Role of Immigration in Canada’s Demographic Outlook,1998,International Migration
"Bertrand, Didier","Refugees and Migrants, Migrants and Refugees. An Ethnological Approach",1998,International Migration
"Jones, H.",A Cultural Economy Perspective on Service Sector Migration in the Global City: The Case of Hong Kong,1998,International Migration
"Khoo, Louisa-May","Home, Work and Community: Skilled International Migration and Expatriate Women in Singapore",1998,International Migration
"Chen, Shyh-Jer",Characteristics and Assimilation of Chinese Immigrants in the US Labour Market,1998,International Migration
"Akokpari, John K.","The State, Refugees and Migration in Sub-Saharan Africa",1998,International Migration
"Buckley, Cynthia",Forced Migration and Destination Choice: Armenian Forced Settlers and Refugees in the Russian Federation,1998,International Migration
"Salvo, J.J.",Resurgent Irish Immigration to the US in the 1980s and early 1990s: A Socio-demographic Profile,1998,International Migration
"Semyonov, Moshe","Best of Times, Worst of Times, and Occupational Mobility: The Case of Soviet Immigrants in Israel",1998,International Migration
"Kulu, Hill",Ethnic Return Migration: An Estonian Case,1998,International Migration
"Marr, William","The Unemployment Insurance Compensation Usage of Canada’s Immigrants in Selected Provinces, 1981–1988",1998,International Migration
"Karafolas, Simeon",Migrant Remittances in Greece and Portugal: Distribution by Country of Provenance and the Role of the Banking Presence,1998,International Migration
