AU,TI,PY,JO
,The New Director Of Icem,1961,Migracion
"Perotti, Antonio",The Migration Problem And The Encyclical “Mater Et Magistra”,1961,Migracion
"Marsal, Juan F.",Argentina As An Immigration Country,1961,Migracion
"Dominedo, M.",How Migration Affects The Country Of Emigration,1961,Migracion
"Zubrzycki, Jerzy",Sociological Methods For The Study Of Immigrant Adjustement,1961,Migracion
"Daly, Marcus",Foreword,1961,Migracion
,Editorial,1961,Migracion
"Downer, Alexander R.",The Influence Of Migration On Australian Foreign Policy*,1961,Migracion
Migrator,Prospects And Machinery Of European Migration Movements Within The European Economic Community,1961,Migracion
"Neiva, Artur Hehl",The Importance Of Immigration In The Development Of Brazil,1961,Migracion
"Agapitidis, Sotirios",Emigration From Greece,1961,Migracion
,Information,1961,Migracion
,Resolutions Of The Thirteenth Session Of The Council Of The Intergovernmental Committee For European Migration,1961,Migracion
,Book Reviews,1961,Migracion
,Bibliography,1961,Migracion
,,,
"Holborn, Louise W.",INTERGOVERNMENTAL PARTNERSHIP FOR PLANNED MIGRATION,1961,Migracion
,THE REPORT OF THE INTERGOVERNMENTAL COMMITTEE FOR EUROPEAN MIGRATION FOR THE YEAR 1960,1961,Migracion
"Zubrzycki, J.",GREEK IMMIGRANTS IN AUSTRALIA,1961,Migracion
,,,
"Thomas, Brinley",TRENDS IN THE INTERNATIONAL MIGRATION OF SKILLED MANPOWER,1961,Migracion
"de Ávila, Father Fernando Bastos","IMMIGRATION, DEVELOPMENT AND INDUSTRIAL EXPANSION IN BRAZIL",1961,Migracion
"Sandrini, Squarto",THE INTERNATIONAL CENTRE FOR INFORMATION AND RESEARCH ON VOCATIONAL TRAINING: A JOINT REALIZATION OF THE COUNCIL OF EUROPE AND THE INTERNATIONAL LABOUR OFFICE,1961,Migracion
,THE TURIN INTERNATIONAL LABOUR EXHIBITION,1961,Migracion
"Leduc, François",THE TENTH ANNIVERSARY OF ICEM,1962,Migration
"Maccotta, Giuseppe W.",EUROPEAN MULTILATERAL ORGANIZATIONS CONCERNED WITH THE MOVEMENT OF WORKERS,1962,Migration
,REPORT OF THE INTERGOVERNMENTAL COMMITTEE FOR EUROPEAN MIGRATION FOR THE YEAR 1961,1962,Migration
"Sauvy, Alfred",REVERSAL OF DIRECTION IN TRADITIONAL MIGRATION,1962,Migration
,THE FREE MOVEMENT OF WORKERS IN EEC COUNTRIES,1962,Migration
"Price, Charles A.","OVERSEAS MIGRATION TO AND FROM AUSTRALIA, 1947–1961",1962,Migration
"Cachero, Luis A. Martinez",ECONOMIC AND SOCIAL REPERCUSSIONS OF SPANISH EMIGRATION TO COUNTRIES OVERSEAS,1962,Migration
"Dominedo, Francesco M.",HOW MIGRATION AFFECTS THE COUNTRY OF IMMIGRATION,1962,Migration
"Migration, Intergovernmental Committee for European",Foreword,1962,Migration
"Parenti, Giuseppe",INTRODUCTION,1962,Migration
,Preliminaries,1962,Migration
,First Meeting: CHARACTERISTICS OF INTERNATIONAL MIGRATION AT THE PRESENT DAY,1962,Migration
,Second Meeting: MIGRATIONS BETWEEN COUNTRIES AT EQUAL LEVELS OF DEVELOPMENT,1962,Migration
,Third Meeting: MIGRATIONS BETWEEN COUNTRIES AT DIFFERENT STAGES OF DEVELOPMENT,1962,Migration
,Fourth Meeting: INTERNATIONAL ACTION,1962,Migration
"Beijer, G.",EMIGRATION A SOCIAL OUTLET*,1962,Migration
"Busa, Father Roberto","BIBLIOGRAPHICAL REFERENCES AND NOTES ON THE HUMANISTIC, PHILOSOPHICAL AND RELIGIOUS ASPECTS OF EMIGRATION",1962,Migration
"Sauty, Alfred",REVERSAL OF MIGRATION TRADITIONAL FLOW,1962,Migration
"Thomas, Brinley",THE ECONOMIC RESURGENCE OF WESTERN EUROPE AND ITS BEARING ON OVERSEA EMIGRATION,1962,Migration
,Francis E. Walter In Memoriam,1963,International Migration
,Editorial,1963,International Migration
"Beijer, G.",Some Recent Publications on Latin America: A Confrontation Of Opinions,1963,International Migration
"Zanartu, M.",Itnrnigration and Development*,1963,International Migration
"HERRERA, F.",Outlook for a Greater European Cooperation in the Latin-American Development Effort,1963,International Migration
"Diegues, M.",Rural Settlement in Latin America*,1963,International Migration
"Stouse, P. A.",A Framework for Measurement of Development in Latin-American Land Settlement Projects,1963,International Migration
,Latin America in the Latin-American Press,1963,International Migration
,Selected bibliography on Latin America 1945–1962,1963,International Migration
,"Books, Periodicals, Pamphlets, Statistics",1963,International Migration
"Geyl, W. F.",A brief History of Australian Immigration,1963,International Migration
"Richardson, A.",British Migration to Australia,1963,International Migration
"Mol, J. J.",The Function of Marginality,1963,International Migration
"Zammit, Hon. Alexander Cachia",Malta and Migration,1963,International Migration
"Katzen, L.",South-African Immigration and Emigration in the Post-war Period,1963,International Migration
"Price, C. A.",The Integration of religious Groups in Australia,1963,International Migration
,A recent Publication on the United States' Immigration Policies*,1963,International Migration
,Aspects de l'augmentation de la population et ses conséquences en Amérique latine,1964,International Migration
,L'aide fournie par le Cime en vue de développer les services d'immigration nationaux en Amérique latine,1964,International Migration
,Premier Cours latino-américain sur les migrations,1964,International Migration
"Germani, G.",L'évolution démographique en Amérique latine et son influence sur le marché du travail,1964,International Migration
"Bagú, S.",L'intégration des immigrants,1964,International Migration
"Moles, R.",Sécurité sociale des travailleurs migrants,1964,International Migration
"Botija, E. PÉRez",Aspects juridiques de la migration,1964,International Migration
"Arndt, H. W.",L'économie australienne et les migrations,1964,International Migration
"Borrie, W. D.","Les travailleurs allemands, italiens et grecs en Australie",1964,International Migration
"Connor, Desmond M.",Selective Migration and Residence,1964,International Migration
"Mcewan, Peter J. M.",European Assimilation in a non European Context,1964,International Migration
"Crennan, Monsignor G. M.",Voluntary Agencies in a Migration Programme,1964,International Migration
"Cnossen, T.",Integration of Refugees,1964,International Migration
"Zubrzycki, Por Jerzy",Participación de los inmigrantes en la vida de una colectividad Australiana* (I),1964,International Migration
"Lawless, D. J.",La actitud de los dirigentes de grupos de inmigrantes y de minorias étnicas de Vancouver ante la integración en la vida Canadiense*,1964,International Migration
,Dos publicaciones recientes sobre la emigración neerlandesa*,1964,International Migration
"Cnossen, De T.",Thwarted Exodus,1964,International Migration
"McQUADE, G. D.",Tendencias De La Inmigración En El Canadá,1964,International Migration
"Jones, F. Lancaster",The Territorial Composition of Italian Emigration to Australia 1876 to 1962*,1964,International Migration
"Schneiter, P.",Some Consequences of Structural Changes in Agriculture and of Technological Changes in other Economic Sectors of Europe,1964,International Migration
"Constandse, A.K.",The Cultural Influence of Government Agencies on New Rural Settlement,1964,International Migration
"Bideberry, P.",Some Features of Immigration in France and in Europe,1964,International Migration
"Zubrzycki, J.",Immigrant Participation in an Australian Community*,1964,International Migration
"THOMAS, JOHN F.",U.S.A. as a Country of First Asylum,1965,International Migration
"AULICH, WERNER",Why History of Migration is Important,1965,International Migration
"MATEO, POR F. VÁZQUEZ",La adaptatión a un mundo nuevo,1965,International Migration
"WEBER, R.",The Employment of Aliens in Germany*,1965,International Migration
"JOHNSTON, RUTH",The Concept of the ‘Marginal Man,1965,International Migration
"TIMLIN, M. F.",Canadian Immigration Policy: an Analysis,1965,International Migration
,Nuevas perspectivas para la colonizaiön Agrícola en Argentina,1965,International Migration
"SCHEFF, THOMAS J.",Changes in Public and Private Language among Spanish-Speaking Migrants to an Industrial City*,1965,International Migration
"BENN, D.G.",The New U.S.A. Immigration Law,1965,International Migration
,"Public Law 89–236 89th congress, H. R. 2580 October 3, 1986 An Act",1965,International Migration
,Scope for Latin America,1965,International Migration
,UN PROJET D'AVENIR POUR L'AMÉRIQUE LATINE,1965,International Migration
,AMéRICA LATINA,1965,International Migration
"MAYER, K. B.",Post-War Migration to Switzerland*,1965,International Migration
"MOL, J. J.",The Decline in Religious Participation of Migrants,1965,International Migration
"McDONALD, J. R.",The Repatriation of French Algerians 1962–1963,1965,International Migration
,ICEM Language Training for Migrants,1965,International Migration
,The World Population Conference 1965,1965,International Migration
"BESTERMAN, W. M.",Immigration as a Means of obtaining needed Skills and stimulating Economic and Social Advancement,1965,International Migration
"JOHNSTON, R.",The occupational Distribution and the Level of Education of Polish Immigrants n Western Australia,1965,International Migration
"AULICH, W.",The Process of a Reciprocal Assimilation,1965,International Migration
"BERNARD, W. S.",America‘ s Immigration Policy: Its Evolution and Sociology*,1965,International Migration
"CNOSSEN, T.",ICVA's Conference,1965,International Migration
"BARKIN, BYS.",Trade Union Policies and Programmes for National Internal Rural Migrants and Foreign Workers,1966,International Migration
"RICHMOND, A. H.",Demographic and Family Characteristics of British Immigrants returning from Canada,1966,International Migration
"BEIJER, G.",Selective Migration for and ‘Brain Drain’ from Latin America,1966,International Migration
"GUYE, PAR R.",Caractéristiques des différents Pays d'Arnérique Latine,1966,International Migration
"WILDER-OKLADEK, F.",Austrian and German Immigration in Israel,1966,International Migration
"JOHNSTON, R.",The Assimilation of Immigrant Women in the Work Force,1966,International Migration
"REES-POWELL, ALAN","Differentials in the Integration Process of Dutch and Italian Immigrants in Edmonton, Canada*",1966,International Migration
,Italian Emigration*,1966,International Migration
"Schou, Cleve",The Resettlement of Handicapped Refugees,1966,International Migration
"Hofmeije, D. H.",On Anticipating The Future,1966,International Migration
"Heiss, J.",Residential Segregation And The Assimilation Of Italians In An Australian City,1966,International Migration
"Backer, J. E.",Norwegian Migration 1856–1960*,1966,International Migration
"Monroe, J. J.",Regional Variation In French Emigration Rates,1966,International Migration
"SNEDDEN, B.M.",An Australian view of ICEM,1967,International Migration
"TUINMAN, A.S.",Dutch Settlements in Brazil*,1967,International Migration
"WEINBERG, A. A.",Immigration from Western Countries in Israel,1967,International Migration
"CAVELAARS, A. A. C.",Integration of a Group of Dutch Settlers in British Columbia,1967,International Migration
"CACHERO, POR L. A. MARTINEZ",Constantes en la emigration española a ultramar,1967,International Migration
,Univesity Professors for Latin America,1967,International Migration
"HAVEMAN, B. W.",ICEM The very Essence of its Existence*,1967,International Migration
"MASELLI, G.",Immigration as an essential Element for the Development of Latin America*,1967,International Migration
"SCOTT, A. D.",Determinants of Migration: The Highly Skilled*,1967,International Migration
,Italian Emigration,1967,International Migration
"JOHNSTON, R.",The Influence of the Ethnic Association on the Assimilation of its Immigrant Members,1967,International Migration
,Two recent Publications on the Assimilation of Immigrants in Australia,1967,International Migration
"SOSKIS, PH.",Ten Years Later*,1967,International Migration
"Hochbaum, J.",Social Planning for Immigrant Absorption,1967,International Migration
"Olschak, B.C.",Tibetans In Migration,1967,International Migration
"Wong, P.",The Social Psychology Of Refugees In An Alien Social Milieu,1967,International Migration
,Italian Emigration In 1966,1967,International Migration
"Gurzynski, Z. S.",The Role of Immigration in South Africa[1],1967,International Migration
"Beijer, G.",The Brain Drain from the Developing Countries and the Need for the Immigration of Intellectuals and Professionals,1967,International Migration
"OPDAHL, ØYSTEIN",A Norwegian View of ICEM*,1968,International Migration
"Doczy, A. G.",Life Problems of Young Adolescent Immigrant Boys in Australia1,1968,International Migration
"Rogers, T. W.","Differential Net Migration Patterns in the SMSA's of the Southern United States, 1950–1960*",1968,International Migration
,"Migration of Netherlands Engineers, Physicians and Scientists*",1968,International Migration
"Goantiang, T.",Some Notes on Internal Migration in Indonesia,1968,International Migration
"Besterman, Walter M.",Freedom of Movement,1968,International Migration
"Gonzales, Luis Segui",El Programa de Migracion Selectiva para America Latina (I)*,1968,International Migration
"Zubrzycki, Jerzy",Some Aspects of Structural Assimilation of Immigrants in Australia,1968,International Migration
,University and Science across the World*,1968,International Migration
"Schou, C.",To cope with a Crisis: A MEDICAL REPORT ON THE HUNGARIAN EMERGENCY,1968,International Migration
"Johnston, Ruth",The Attitude of Australian Communities in two Country Towns in Western Australia towards Immigrants,1968,International Migration
"APPLEYARD, R. T.",International Migration and Social Mobility* An Australian Case Study,1968,International Migration
"POUSSIN, PAR ET. DE LA VALLEE",Les nouvelles tǎches du CIME l'Emigration sélective,1968,International Migration
"JOHNSTON, RUTH",The Australian Character in the Eyes of Polish Immigrants in Western Australia,1968,International Migration
"JOHNSTON, RUTH",Immigrants' Search for cultural Identity,1968,International Migration
"RICHARDSON, ALAN",A Shipboard Study of some British born Immigrants returning to the United Kingdom from Australia*,1968,International Migration
"Mcdonald, James R.",Toward a Typology of European Labor Migration*,1969,International Migration
"Rogers, T. W.",Migration Prediction On The Basis Of Prior Migratory Behavior: A Methodological Note,1969,International Migration
,La Prediction De La Migration Fondee Sur Le Comportement Migratoire Anterieur. Note Methodologique,1969,International Migration
"Kunz, Egon F.",The Engineering Profession and the Displaced Person Migrant in Australia,1969,International Migration
"Muir, J. Douglas",Should The Brain Drain Be Encouraged? A Critical Look At The Grubel-Scott Approach,1969,International Migration
"David, Henry P.",Involuntary International Migration: Adaptation of Refugees*,1969,International Migration
"Samuel, T. J.",Migration of Canadians to U.S.A.: The Causes*,1969,International Migration
,"Council of Europe Second European Population Conference Strasbourg, Sept. 1971",1969,International Migration
"Beyer, G.","The General Conference of the International Union for the Scientific Study of Population, London, 3–11 September 1969",1969,International Migration
"Weiermair, Klaus",Economic Implications of the International Migration of High Level Manpower*,1970,International Migration
"MONCARZ, RAUL",Effects of Professional Restrictions on Cuban Refugees in Selected Health Professions in the United States 1959–1969*,1970,International Migration
"BERNARD, THOMAS L.",United States Immigration Laws and the Brain Drain,1970,International Migration
"LADAME, PAUL",Contestée: La circulation des élites*,1970,International Migration
"LEE, TREVOR R.","The Role of the Ethnic Community as a Reception Area for Italian Immigrants in Melbourne, Australia",1970,International Migration
,Twenty Years Research Group for European Migration Problems,1970,International Migration
"BEIJER, G.",International and National Migratory Movements*,1970,International Migration
"MONCARZ, RAUL","Professional Adaptation of the Cuban Teachers in the United States, 1959–1969*",1970,International Migration
,Italian Emigration*,1970,International Migration
,Italian Communities Abroad*,1970,International Migration
"HULTMAN, CHARLES W.",Factor Migration: Trade Theory and Growth Centers,1970,International Migration
,Information,1970,International Migration
"Bender, Eberhard",Asylum in the Federal Republic of Germany and Some Problems connected therewith,1970,International Migration
"Li, Wen L.",Matrix Analysis Of Migration Streams*,1970,International Migration
"Scobie, Marrigje","Foreign Research Personnel in Higher Education in Norway, 1968",1970,International Migration
"Böhning, W. R.","The Differential Strength of Demand and Wage Factors in Intra-European Labour Mobility: with Special Reference to West Germany, 1957–1968",1970,International Migration
"Weiermair, Klaus",Economic Adjustment of Refugees in Canada: A Case Study*,1971,International Migration
"Fensham, P. J.",National Background and Choice of Tertiary Education in Victoria1,1971,International Migration
"Kunz, Egon F.",Political Events ‘At Home’ and the Concept of Catharsis Naturalization among Refugees,1971,International Migration
"Kunz, Egon F.",European Migrant Absorption in Australia,1971,International Migration
"Comay, Yochanan","Salaries, Employment Opportunities and Migration of Engineers",1971,International Migration
"BEYER, G.",Editorial,1971,International Migration
"Beyer, G.",Council of Europe European Population Conference*,1971,International Migration
"Maselli, G.",World Population Movements,1971,International Migration
"Van Praag, Philip",Aspects économiques à long terme des migrations internationales dans les pays de la C.E.E.,1971,International Migration
"Burnley, J. H.","Italian Migration and Settlement in New Zealand,1874–1968",1971,International Migration
,Award of the Fridtjof Nansen Ring to the Director of ICEM,1972,International Migration
"Wander, Hilde",Social and Economic Importance of Overseas Migration from Europe*,1972,International Migration
,Human Rights and Refugees*,1972,International Migration
"Rogers, Tommy W.",Migration Patterns of the Tennessee Population,1972,International Migration
"Brown, L. B.",A Social-Psychological Study of Latvian Immigrants in Canberra,1972,International Migration
"Wenk, Michael G.",Current U.S. Immigration Legislation: Analysis and Comment*,1972,International Migration
"Moncarz, Raul",Cuban Lawyers: Ten Years Later*,1972,International Migration
"Burnley, I. H.",Greek and Polish Refugee Settlers in New Zealand,1972,International Migration
"Moldofsky, Naomi",Language,1972,International Migration
"Burnley, Ian H.","The Ecology of Greek Settlement in Melbourne, Australia",1972,International Migration
"Hoar, P. C.","Immigration to Canada in the 1920's, Some Economic Determinents*",1972,International Migration
"Li, Wen L.",Japanese Immigration and Economic Growth in Taiwan*,1972,International Migration
"Pincus, Chasya",Hosts And Strangers,1972,International Migration
"Rama, Carlos M.",Information,1972,International Migration
,Inrernarional Geographical Union Commission On Population Geography:Symposium On Migration,1972,International Migration
"Elizur, D.",Attitudes and Intentions of Israelis Residing in the U.S. Towards Returning to Israel*,1973,International Migration
"Freedman, Robert L.",Nutrition Problems and Adaption of Migrants in a New Cultural Environment*,1973,International Migration
"John-Jones, L. W. St.",The Exchange of Population between the United States of America and Canada in the 1960s,1973,International Migration
"Jones, Huw R.",The Regional Origin of Emigrants: Findings from Malta,1973,International Migration
"Vanegas, Jose Salomon Delgado",Aporte Sociológico de las Migraciones Europeas al Desarrollo Nacional,1973,International Migration
,SEMINAR ON ADAPTATION AND INTEGRATION OF PERMANENT IMMIGRANTS,1973,International Migration
"Bernard, William S.",Indices of Integration into the American Community,1973,International Migration
"Gonzales, Luis Segui",Asistencia Técnica en Legislación Migratoria,1973,International Migration
"Almeida, Carlos C.","Emigration, espace et sous-développement",1973,International Migration
"Guild, Christine",Aspects of Canadian Immigration: 1951-71,1973,International Migration
"John-Jones, L. W. St.",Canadian Immigration: Policy and Trends in the 1960s,1973,International Migration
"Moncarz, Raul",A Model of Professional Adaptation of Refugees: The Cuban Case in the U.S. 1959–1970*,1973,International Migration
"Moncarz, Raul",Cuban Architects and Engineers in the United States,1973,International Migration
"Drettakis, E. G.",Changes in the Composition and SEctoral Distribution of Migrant Workers in West Germany 1960–1972,1973,International Migration
"Markopoulou, Christine",A Project of Social Work with Cypriot Immigrants in London,1974,International Migration
"Vergara, Por Julio Morales","Latinoamericanos en Europa, Aspectos Demogràficos Examinados a la Luz de Antecedentes Censales de Algunos Países Seleccionados",1974,International Migration
"Cox, David R.",Selection and Preparation of Applicants for Emigration to Australia*,1974,International Migration
"Green, Alan G.","Is Foreign Labour Complementary or Competitive (in Terms of Skill) With Native Born Labour? The Canadian Case, 1911–1941*",1974,International Migration
"Rogers, Tommy W.",Migration of the Aged Population*,1974,International Migration
"Rudzitis, A.",Subjective Assimilation among Latvian Adolescents: Effects of Ethnic Schools and Perception of Value Systems1,1974,International Migration
"Beyer, G.","Books, Periodicals, Pamphlets, Statistics",1974,International Migration
"BERNARD, WILLIAM S.",Their Nature and Role in the Adaptation and Integration of Permanent Immigrants,1974,International Migration
"AHIRAM, E.",Language Training,1974,International Migration
"THELLMAN-GUSTAVSON, B.",Vocational Training for Immigrants,1974,International Migration
"DUMON, W. A.",Educational Adaptation of Permanent Migrants,1974,International Migration
"WERNER, HEINZ",Migration and Free Movement of Workers in Western Europe*,1974,International Migration
"BEYER, G.",Seminar on Demographic Research in Relation to International Migration,1974,International Migration
"MURPHY, H. B. M.",Mental Health Guidelines for Immigration Policy,1974,International Migration
"Bernard, William S.",Refugee Asylum in the United States: How the Law was Changed to Admit Displaced Persons,1975,International Migration
"Eichenbaum, Jacob",A Matrix of Human Movement,1975,International Migration
"Moldofsky, Naomi",Expellees and ‘Voluntary’ Refugees from Less-developed Lands,1975,International Migration
"Schulz, Peter",Turks and Yugoslavs: Guests or New Berliners?,1975,International Migration
"Beyer, G.","Books, Periodicals, Pamphlets, Statistics",1975,International Migration
"SALOMONE, FRANK A.",The Role of the Voluntary Agencies in the Resettlement of Ugandan Asians in the U.S.A.,1975,International Migration
"FINLEY, TERENCE",The permanent Settlement of African Refugees,1975,International Migration
"KEELY, CHARLES B.",Temporary Workers in the United States,1975,International Migration
"KRANE, R. E.",Manpower Mobility: The Case of Turkey and West Germany,1975,International Migration
"LIANOS, THEODORE P.",Flows of Greek Out-Migration and Return Migration,1975,International Migration
"TOREN, NINA",The Effect of Economic Incentives on Return Migration,1975,International Migration
,Dutch Immigration Policy and the Myth of Return,1975,International Migration
"RICHMOND, ANTHONY H.",Canadian Immigration: Recent Developments and Future Prospects*,1975,International Migration
"O'NEILL, C. J.",Migration Policy and Population Growth in New Zealand*,1975,International Migration
"SCHULZ, PETER",Labor Migration among the Socialist European Countries in the Post-World War II Period,1975,International Migration
"MONCARZ, RAUL",The Cuban Accountant in the U.S.A. 1959–1969*,1975,International Migration
"KUHN, G.",The Adaptation and Integration of Selective Immigrants in Brazil Report on an Enquiry*,1975,International Migration
"BEYER, G.","Books, Periodicals, Pamphlets, Statistics",1975,International Migration
"Dumon, W. A.",Family Migration and Family Reunion*,1976,International Migration
"Bernard, William S.",How to influence the Public for a better Understanding of the Problems of Immigrant Families and Social Welfare Measures needed in order to facilitate a better Integration of the Newcomers,1976,International Migration
"Stark, T.",Views of Non-Governmental Organizations on Family Migration,1976,International Migration
"PEKIN, HÜSEYIN",Placement Assistance to returning Migrants and other Type of Assistance including Reception and Accommodation,1976,International Migration
"Abete, Giovanni",Vocational Training Courses for returning Migrants before their Departure from the Country of Immigration and after their Arrival in the Country of Origin,1976,International Migration
"Moro, Octavio Cabezas",The Relation between Migration Policy and Economic Development and the Promotion of New Employment Possibilities for Returnees (Foreign Investment and Migrant Remittances),1976,International Migration
"Saito, Hiroshi",The Integration and Participation of the Japanese and their Descendants in Brazilian Society,1976,International Migration
"GONZÁLEZ, LUIS SEGUÍ",La Cooperaciín Internacional en la Migraciín*,1976,International Migration
"HOPE, KEMPE R.",The Emigration of High-level Manpower from Developing to Developed Countries (with Reference to Trinidad & Tobago),1976,International Migration
"Baskauskas, Liucija",Planned Incorporation of Refugees: the Baltic Clause,1976,International Migration
