AU,TI,PY,JO
"LOHRMANN, REINHARD",European Migration Recent Developments and future Prospects,1976,International Migration
"BERNARD, WILLIAM S.","Immigrants and Refugees: Their Similarities, Differences, and Needs",1976,International Migration
"Carlson, Alvar w.","A Map Analysis of Middle East Immigrants in Detroit and Suburbs, 1961–1974",1976,International Migration
"TRLIN, A. D.","Centripetal and Centrifugal Residential Movement. The Case of Dutch Immigrants in Auckland, New Zealand",1976,International Migration
"GUHA, AMALENDU",Brain drain Issue and Indicators on Brain-Drain,1977,International Migration
"SKULLEY, MICHAEL T.",Australia's Immigration Programme: an Evaluation of its Effectiveness*,1977,International Migration
"CONAWAY, MARY ELLEN",Circular Migration in Venezuelan Frontier Areas,1977,International Migration
"BEYER, G.","Books, Periodicals, Pamphlets, Statistics",1977,International Migration
"CHUKUNTA, N.K. ONUOHA",Human Rights and the Brain Drain,1977,International Migration
"HOROWITZ, RUTH TAMAR",Immigrants in Transition: The Israeli Absorption Center,1977,International Migration
"WERNER, HEINZ",Some Current Topics of Labour Migration in Europe Some Past Facts and Figures,1977,International Migration
"Jelden, Helmut",A Model for building a Co-operative World,1978,International Migration
"BÖHNING, W. R.","International Migration and the Western World: Past, Present, Future",1978,International Migration
"Persson, Gunnar",School Achievement of Immigrant Children: The Impact of Social Class and Nationality,1978,International Migration
"Beyer, G.","Books, Periodicals, Pamphlets, Statistics",1978,International Migration
"Volek, Zdenek",Changing Characteristics of Refugees as Immigrants to Australia,1978,International Migration
"GUHA, AMALENDU",Intra-COMECON Manpower Migration,1978,International Migration
"HALEVY, ZVI",Were the Jewish Immigrants to the United States Representative of Russian Jews?,1978,International Migration
"KING, RUSSELL",Work and Residence Patterns of Italian Immigrants in Great Britain*,1978,International Migration
"BRISTOW, MIKE",Ugandan Asians in Exile: Household and Kinship in the Resettlement Crisis,1978,International Migration
"AMERA, ANNA",The Education of Greek Migrant Children in Australia: a Parent View*,1978,International Migration
"PUTNI?Š, ALDIS L.",Ethnic Identification in Second Generation Latvians,1978,International Migration
"ROGERS, T. W.",Judicial Interpretation of Internal Migration as a Constitutional Right in the United States of America,1978,International Migration
"PERCAL, RAUL MONCARZ",The Golden Cage,1978,International Migration
"BEYER, G.","Books, Periodicals, Pamphlets, Statistics",1979,International Migration
"WOUDENBERG, HENRY W.",Some Reflections on the Loss of Canadian Economists to the United States,1980,International Migration
"McKEE, DAVID L.",American Economists in Canada: A reversal of the Brain Drain,1980,International Migration
"ROCKETT, IAN R. H.","Education, Immigration and occupational Mobility: A short-term analysis*",1980,International Migration
"KRISHNAN, P.","Toward a prediction of Third-World Immigrants into Canada, 1973–1985*",1980,International Migration
"BEYER, G.","Books, Periodicals, Pumphlets, Statistics",1980,International Migration
"PEKIN, HÜSEYN",Migrant Women in Host Countries: the Situation of Migrant Women Workers,1981,International Migration
"LEY, KATHARINA",Migrant Women: Is Migration a Blessing or a Handicap?: Situation of Migrant Women in Switzerland,1981,International Migration
"PALMER, INGRID",Advancement Preparation and Settlement: Needs of South-East Asian Refugee Women,1981,International Migration
"SUNDHAGUL, MALEE",Situation and Role of Refugee Women: Experiences and Perspectives from Thailand,1981,International Migration
"ROSEN, MRS. RITA",On the Situation of Foreign Women living in the Federal Republic of Germany. An Outline of the Problem,1981,International Migration
"FRITTELLI, MRS. ANNA TERESA",Report on Migrant Women in their Country of Origin,1981,International Migration
"WALTER, MRS. INGRID",The Adjustment of Indochinese Women in the United States (1979–1980),1981,International Migration
"PALMGREN, MRS. IRENE",Situation of Immigrant Women in Sweden,1981,International Migration
"DUMON, W.A.",The Situation of Migrant Women Workers,1981,International Migration
"KUTLUER-YALIM, MRS. ÖZDEN",Migrant Women not gainfully employed,1981,International Migration
"PANAYOTAKOPOULOU, MRS. E.","Specific Problems of Migrant Women returning to the Country of Origin, particularly as regards Employment and Social Services",1981,International Migration
"ALEXANDRAKI, MS. C.",Services rendered by ICM to Migrant and Refiugee Women,1981,International Migration
"PINTO, A.",Undocumented and illegally resident Migrant Women in Venezuela,1981,International Migration
"ALVAREZ, JUAN TESTA",Social Advancement of Migrant Women,1981,International Migration
"TZIAFETAS, GEORGE N.",Statistical Analysis of the Emigration Flow from Greece,1982,International Migration
"DELIA, E. P.",The Determinants of Modern Maltese Emigration,1982,International Migration
"GONDIM, NAVARRO",Manpower Assessment and Planning,1982,International Migration
"AKINCI, A. UGUR",Differentiation of Capital and International Labor Migration: Constructing a Working Hypothesis,1982,International Migration
"CARLSON, ALVAR W.",Recent European Immigration to the Chicago Metropolitan Area,1982,International Migration
"MANCHO, SANTIAGO","Role of Associations as regards Second-generation Migrants, especially from the Point of View of maintaining cultural Links with the Country of Origin",1982,International Migration
"SAUNDERS, E. ANNE",Vocational Counselling with Indo-Chinese Refugees,1982,International Migration
"FEIN, AHARON",Benefits to returning Israelis Need and Eligibility*,1982,International Migration
"CONSTANTAKOS, IRYSIE M.",Variations in Adaptations to America by Greek Home Region,1982,International Migration
"KATZ, BERNARD S.","Internal Migration and Regional Income Distribution in a rapidly developing Economy The Case of Spain, 1960–1969",1982,International Migration
"Schwarz, Karl",Dr. Gunther Beyer (1 904- 1983),1983,International Migration
"BROX, JAMES A.",Migration between the United States and Canada: A Study of Labour Market Adjustment,1983,International Migration
"HAAVIO-MANNILA, ELINA",Level of Living of Immigrants in Sweden,1983,International Migration
"MILLER, MARK J.",U. S. Immigration Policy: the Guestworker Option Revisited*,1983,International Migration
"TZIAFETAS, GEORGE N.",Statistical Estimation of Socio-Economic Factors affecting Migration in W. Europe,1983,International Migration
"LEE, WOO GAK",Destinations of International Travel by the US. Population,1983,International Migration
,Bibliography on Undocumented Migrants or Migrants in an Irregular Situation: Bibliographie sur les migrants sans documents ou en situation irrégulière: Bibliografía sobre los migrantes indocumentados o en situación irregular,1983,International Migration
"Carlin, James L.",Statement by the ICM Director,1983,International Migration
,Specific Motivations and Underlying Causes of Undocumented Migration,1983,International Migration
,The Rights and Obligations of Migrants in Receiving Countries Preservation of the fundamental Human Rights of Undocumented Migrants,1983,International Migration
,Undocumented Migrants and the Regularization of their Status,1983,International Migration
,Effects of Undocumented Migration Possible Remedies and Solutions,1983,International Migration
,(a) Examination of the negative Effects for Countries and Individuals concerned,1983,International Migration
,"(b) Specific Measures, including Agreements between directly interested Countries to avoid or reduce the Flow of Undocumented Migrants",1983,International Migration
"Dumon, W.",Note from the Editor,1983,International Migration
"COX, DAVID",Refugee Settlement in Australia: Review of an Era,1983,International Migration
"KATS, RACHEL",Occupational Mobility of Immigrants and their Job Satisfaction A Secondary Analysis (I),1983,International Migration
"ROCKETT, IAN R.H.","Ethnicity, Immigration Process and short-term occupational Mobility",1983,International Migration
"HOUSTOUN, MARION F.","Aliens in Irregular Status in the United States: A Review of their Numbers, Characteristics, and Role in the U.S. Labor Market",1983,International Migration
"Elich, J.H.",Current Events and Developments,1983,International Migration
"MISHLER, WILLIAM",Public Opinion toward New Migrants: A Comparative,1983,International Migration
"WEIDACHER, ALOIS",Policy with respect to Aliens and Migration Research in the Federal Republic of Germany 1973 – 1983,1983,International Migration
"MCKEE, DAVID L.",Some Specifics on the Brain Drain from the Andean Region,1983,International Migration
"MAHMOUD, MAHGOUB EL-TIGANI",Sudanese Emigration to Saudi Arabia,1983,International Migration
"KIRKLAND, JAMES R.",The Social Adjustment of Armenian Immigrants in Australia,1983,International Migration
"Atchison, John",Patterns of Australian and Canadian Immigration 1900–1983,1984,International Migration
"Danziger, Nira","The Contagion Effect, An additional Aspect in the Dynamics of Emigration: the Case of Israel",1984,International Migration
"Samuel, T.J.",Economic Adaptation of Refugees in Canada: Experience of a Quarter Century,1984,International Migration
"HUTCHISON, RAY",Miscounting the Spanish Origin Population in the United States: Corrections to the 1970 Census and their Implications,1984,International Migration
"PASSARIS, CONSTANTINE",The Economic Determinants of Canada's Multicultural Immigration,1984,International Migration
"KIRKLAND, JAMES RAY","Armenian Migration, Settlement and Adjustment in Australia",1984,International Migration
"KATS, RACHEL",Migration and Research Commitments: Long-term Effects of National Socialization,1984,International Migration
"APPLEYARD, R.T.",International Migration in a Changing World,1984,International Migration
"DERYCKERE, PHILIPPE",A Comparative Illustration of the Life-cycle of Economic Migration (1960 – 1980),1984,International Migration
"DE WENDEN, CATHERINE WIHTOL",The Evolution of French Immigration Policy after May 1981,1984,International Migration
"MUSCHKIN, CLARA G.",Demographic Consequences of Migration Trends in Puerto Rico: 1950 – 1980,1984,International Migration
"STRAUBHAAR, THOMAS",The Accession of Spain and Portugal to the EC from the Aspect of the Free Movement of Labour in an enlarged Common Labour Market,1984,International Migration
"PAPADEMETRIOU, DEMETRIOS G.","Immigration Reform, American Style",1984,International Migration
"LEBON, PAR ANDRÉ",Les envois de fonds des migrants et leur utilisation,1984,International Migration
"DAMIAN, NATALIA",Immigrants and their occupational Absorption: The Israeli Case,1984,International Migration
"PENNINX, R.",Research and Policy with regard to Ethnic Minorities in the Netherlands; an historical Outline and the State of Affairs,1984,International Migration
"LIMAGE, LESLIE J.",Young Migrants of the Second Generation in Europe: Education and Labour Market Insertion Prospects,1984,International Migration
"JENNY, R.K.",Current Trends and Developments: The Changing Character of Contemporary Migration,1984,International Migration
"GOULD, W.T.S.",International Migration of Skilled Labour within Africa: A Bibliographical Review,1985,International Migration
"JIMENEZ, CAROL J.",Filipino Workers in the Middle East: Social Profile and Policy Implications,1985,International Migration
"BIFFL, G.",Structural Shifts in the Employment of Foreign Workers in Austria,1985,International Migration
"COX, D.",Welfare Services for Migrants Can they be better planned?,1985,International Migration
"VERMA, RAVI B.P.",Asian Immigrants in Canada: Some Findings from 1981 Census,1985,International Migration
"LAWLESS, R.J.",Some new Trends in Mediterranean Labour Migration: The Middle East Connection,1985,International Migration
,Joint Meeting on The Impact of International Migration on Third World Development,1985,International Migration
"PAPADEMETRIOU, DEMETRIOS G.",Illusions and Reality in International Migration: Migration and Development in post World War II Greece,1985,International Migration
"WOLOSKI, B.",The Labour Market Experiences of Canadian Immigrants,1985,International Migration
"LIMAGE, LESLIE J.",Policy Aspects of Educational Provision for Children of Migrants in Western European Schools,1985,International Migration
"ENTZINGER, HAN",Return Migration in Western Europe,1985,International Migration
"CARLSON, A. W.",One Century of foreign Immigration to the United States: 1880,1985,International Migration
"JONGKIND, C.F.","The Dutch Colony in Tres Arroyos, Argentina: A Particular Case of Ethnic Group Maintenance*",1985,International Migration
"WISEMAN, JACQUELINE P.",Individual Adjustments and Kin Relationships in the ‘New Immigration’: An Approach to Research,1985,International Migration
"SAUNDERS, E. ANNE","Resettlement Experiences of Russian Jewish Immigrants in Vancouver, Canada between 1975 and 1982",1985,International Migration
"MARR, WILLIAM",The Canadian Temporary Visa Programme as an Alternative to the European Guest Worker Scheme,1985,International Migration
"HILLER, HARRY H.",The Social Organization of Migration: An Analysis of the Uprooting and Flight of Vietnamese Refugees,1985,International Migration
"McKEE, DAVID L.",Argentina and the Brain Drain: Some Perspectives from Expatriates in the United States,1985,International Migration
"DARVISH, TIKVA",Changes in the Employment Structure of Iraqi Jewish Immigrants to Israel,1985,International Migration
"FEIL, CHRISTINE","Migrant Children in the German Kindergarten: Data, Problems, and Pedagogical Models*",1985,International Migration
"MYERS, GEORGE C.",Migration and Household/Family Structure: Puerto Ricans in the United States,1985,International Migration
"DAMIAN, NATALIA",Divorce and Immigration: The Social Integration of Immigrant Divorcees in Israel*,1985,International Migration
"TZOUGAS, J.",International Migration in Greece Statistical Results,1985,International Migration
"KRAUS, RUDOLF","Different Forms, Reasons and Motivations for Return Migration of Persons who Voluntarily Decide to Return to Their Countries of Origin",1986,International Migration
"CALLEA, SAVERIO","Different Forms, Reasons and Motivations for Return Migration of Persons who Voluntarily Decide to Return to Their Countries of Origin",1986,International Migration
,"The Meaning, Modalities and Consequences of Return Migration",1986,International Migration
"LEPORE, SILVIA",Problems Confronting Migrants and Members of Their Families When They Return to Their Countries of Origin,1986,International Migration
"DUMON, W.","Problems Faced by Migrations and their Family Members, Particulary Second Generation Migrants, in Returning to and Reintegrating into their Countries of Origin",1986,International Migration
,The Return of International Labour Migrants in the ESCAP Region,1986,International Migration
"DEBART, MARIE-HELENE",Measures Which Host Countries and Countries of Origin Could Adopt to Promote the Return of Migrants,1986,International Migration
,Measures to Facilitate the Reintegration of Migrants Upon Return to their Countries of Origin,1986,International Migration
"KEELY, CHARLES B.",Return of Talent Programs: Rationale and Evaluation Criteria for Programs to Ameliorate a ‘Brain Drain’,1986,International Migration
"BAUTISTA, E. BRU",Reattraction of Needed Skills to Developing Countries of Origin,1986,International Migration
,Measures to Facilitate the Return and Reintegration of Highly Skilled Migrants into African Countries,1986,International Migration
"OHNDORF, WOLFGANG","The Various Forms, Reasons and Motivations for Return Migration of Persons who Voluntarily Decide to Return to their Countries of Origin",1986,International Migration
"SECCOMBE, IAN J.",Immigrant Workers in an Emigrant Economy:,1986,International Migration
,Working permits issued to non-Jordanian IImmigrants 1973,1986,International Migration
"CRUZ, JUAN E. HERNANDEZ",Reintegration of Circulating Families in Southwestern Puerto Rico*,1986,International Migration
"LOBODZINSKA, BARBARA",Post-War Immigration in the United States and the State of Minnesota:,1986,International Migration
"KUTHIALA, S. K.",Migrant Workers: A Passage from India to the Middle East,1986,International Migration
"GUSTAFSSON, BJÖRN",International Migration and Falling into the Income ‘Safety Net’:,1986,International Migration
"FARMER, RUTH S.J.",International Migration and New Zealand Labour Markets,1986,International Migration
"WERNER, H.",Post-War Labour Migration in Western Europe An Overview,1986,International Migration
"HOPE, ELIZABETH M. THOMAS",Transients and Settlers: Varieties of Caribbean Migrants and the Socio-Economic Implications of their Return,1986,International Migration
"JOCKENHÖVEL-SCHIEKE, HELGA",Realities of Life and Future Prospects within two Cultures,1986,International Migration
"RICHARDS, PETER",Return Migration from Australia A Case Study,1986,International Migration
"CAMMAERT, M.F.",The Long Road from Nador to Brussels,1986,International Migration
"AL-HAJ, MAJID",Adjustment Patterns of the Arab Internal Refugees in Israel,1986,International Migration
"PERRUCHOUD, R.",The Law of Migrants*,1986,International Migration
"TAYLOR, C.",The Feminization of Temporary Workers: The Canadian Case*,1986,International Migration
"MONTGOMERY, R.",The Economic Adaptation of Vietnamese Refugees in Alberta: 1979-84,1986,International Migration
"HURFORD, CHRIS",Statement by Governments: AUSTRALIA THE 1986-87 MIGRATION PROGRAM,1986,International Migration
"ENTZINGER, H.B.","Race, Class and the Shaping of a Policy for Immigrants: The Case of the Netherlands",1987,International Migration
"MICHALOWSKI, M.",Adjustment of Immigrants in Canada: Methodological Possibilities and its Implications*,1987,International Migration
"ARNOLD, F.",Birds of Passage No More: Migration Decision Making among Filipino Immigrants in Hawaii,1987,International Migration
"ZUBRZYCKI, J.",Public Policy in a Multicultural Australia*,1987,International Migration
"HARITOS-FATOUROS, M.",Maternal Attitudes of Greek Migrant Women,1987,International Migration
"Schuck, P. H.",The Status and Rights of Undocumented Aliens in the United States,1987,International Migration
"Suarez-Orozco, M.M.",Hispanic Americans: Comparative Considerations and the Educational Problems of Children*,1987,International Migration
"Helweg, A.W.",Why Leave India for America? A Case Study Approach to Understanding Migrant Behaviour*,1987,International Migration
"Narain, V.",Forms of Migration and Measurement in Social Demography,1987,International Migration
"Kaǧitĉibasi, Ĉiǧdem",Alienation of the Outsider: The Plight of Migrants,1987,International Migration
"de Wenden, C. Wihtol","France's Policy on Migration From May 1981 Till March 1986: Its Symbolic Dimension, its Restrictive Aspects and its Unintended Effects",1987,International Migration
"Salt, J.",Contemporary Trends in International Migration Study,1987,International Migration
"Lohrmann, R.",Irregular Migration: A Rising Issue in Developing Countries*,1987,International Migration
"Moncarz, R.",The Golden Cage,1987,International Migration
"Conyers, T.",The Employment Effects of Immigration: A Balance Sheet Approach*,1987,International Migration
"Thalassions, L.I.",Income Distributional Effects on Factor Returns,1987,International Migration
"Bidegain, G.","Democracia, Migración y Retorno: Los Argentinos, Chilenos y Uruguayos en Venezuela",1987,International Migration
"Papademetriou, D.G.",Current Trends and Developments,1987,International Migration
"Passaris, C.",Canada's Demographic Outlook and Multicultural Immigration,1987,International Migration
"Odynak, D.",A Generalization of Petersen's Typology of Migration*,1987,International Migration
"Limage, L.J.",Economic Recession and Migrant/Minority Youth in Western Europe and the United States*,1987,International Migration
"Khera, I.",Exporting Labor: The Impact of Expatriate Workers on the Home Country*,1987,International Migration
"Rath, J.",Ethnicity and Emancipation*,1987,International Migration
"von Bethlenfalvy, P.",Current Trends and Developments,1987,International Migration
"Atchison, J.",Immigration in Two Federations: Canada and Australia,1988,International Migration
"Nauck, B.",Migration and Change in Parent-Child Relationships. The Case of Turkish Migrants in Germany.,1988,International Migration
"Jutila, S.T.",Socio-economic Stratification Generated by International Migration Loops,1988,International Migration
"Mullan, B.P.",Social Mobility among Migrants between Mexico and the U.S. and within the U.S. Labor Market*,1988,International Migration
"Hansen, L.O.",The Political and Socioeconomic Context of Legal and Illegal Mexican Migration to theUnited States (1942–1984).,1988,International Migration
"Miller, M.J.",Current Trends and Developments,1988,International Migration
"Böhning, W. R.",The Protection of Migrant Workers and International Labour Standards*,1988,International Migration
"Stahl, C. W.",Manpower Export and Economic Development: Evidence from the Philippines*,1988,International Migration
"Samuel, T. J.",Family Class Immigrants to Canada. 1981–84: Part 1*,1988,International Migration
"Lohrmann, R.",Measures to Facilitate the Reintegration of Returning Migrant Workers. International Experiences*,1988,International Migration
"Begag, A.",La Mobilité spatiale des immigrés et ses effets sociaux,1988,International Migration
"Schatzer, P.",Current Trends and Developments,1988,International Migration
"Eaglstein, A. S.",An Analytical Paradigm for the Analysis of National Inmigration Patterns,1988,International Migration
"Sinclair, C. A.","Labour Migration in the Arab Gulf States: Patterns, Trends and Prospects*",1988,International Migration
"Samuel, T. J.",Family Class Immigrants to Canada 1981–1984,1988,International Migration
"Lauro, D.",Chinese Migration and Settlement in a Thai Village,1988,International Migration
"McCready, D. J.",The Expenditure Patterns of the Canadian-born and the Foreign-born in Canada,1988,International Migration
"Mirdal, G. M.",The Interpreter in Cross-Cultural Therapy,1988,International Migration
"Richmond, A.H.",Caribbean Immigrants in Britain and Canad: Socio-economic Adjustment*,1988,International Migration
"Shain, Y.",Who is a Political Exile? Defining a Field of Study for Political Science.,1988,International Migration
"Eelens, F.",Early Return of Sri Lankan Migrants in the Middle East,1988,International Migration
"Tisdell, C. A.",The Developmental Implications of Migration From and Between Small Island Nations,1988,International Migration
"Hardjono, J.",The Indonesian Transmigration Program in Historical Perspective,1988,International Migration
"Dail, P. W.",Immigration and Migration in America: Social Impact and Social Response*,1988,International Migration
"Similä, M.",Situation and Ethnic Identity,1988,International Migration
"Mehrländer, U.",Current Trends and Developments,1988,International Migration
"Lundström, S.",Two Ways of Intergrating Immigrants: Israel,1988,International Migration
"PAPADEMETRIOU, D. G.",The U. S. Legalization Program: A Preliminary Final Report*,1989,International Migration
"NAUCK, B.",Assimilation Process and Group Integration of Migrant Families,1989,International Migration
"DIKAIOU, M.",Peer Interaction in Migrant Children Observational Data and Parents' Evaluations,1989,International Migration
"MULLAN, B. P.",The Impact of Social Networks on the Occupational Status of Migrants,1989,International Migration
"IREDALE, R.",Barriers to Migrant Entry to Occupations in Australia*,1989,International Migration
"Pongsapich, A.",The Case Of Asian Migrants To The Gulf Region,1989,International Migration
"Coelho, A. Bento",Effects of Migration on Social Change in the Country of Origin,1989,International Migration
"Koch, L.",Impact of the Reversal of the Migration Situation on the Social Structures of Certain Countries,1989,International Migration
"Martinez, J. N. Cely",Social Effects of Labour Migration: The Colombia Experience,1989,International Migration
"Ohndorf, W.",Social Effects of Migration in Receiving Countries,1989,International Migration
"Bergman, E.",Social Effects of Migration in Receiving Countries,1989,International Migration
"Isaias, E. Bello",Social Effects of Group Migration Between Developing Countries,1989,International Migration
"Sanz, L. Cariola",The Impact Of Chilean Migration On Employment In Patagonia*,1989,International Migration
"Dumon, W. A.",Family and Migration,1989,International Migration
"LEMOINE, M.",Effects of Migration on Family Structure in the Receiving Country,1989,International Migration
"Pekin, H.",Effects of Migration on Family Structure,1989,International Migration
"Okoth-Ogendo, H. W. O.",The Effect of Migration on Family Structures in Sub-Saharan Africa,1989,International Migration
"Orellana, R. Torrealba",Migratory Movements and their Effects on Family Structure: The Latin American Case,1989,International Migration
"MUUS, P.",No Limits for Migration after 1992? The Lessons of the Past and a Reconnaissance of the Future*,1989,International Migration
"PUTNAM, S.L.",Physician-Nurse Migration to the United States: Regional and Health Status Origins In Relation to Legislation and Policy,1989,International Migration
"OOMMEN, T. K.",India: ‘Brain Drain’ or the Migration of Talent?,1989,International Migration
"LABADIE, G. J.",Causes of Uruguayan Migration to Argentina,1989,International Migration
